{
  "format": "angie-dashboard",
  "formatVersion": 1,
  "document": {
    "id": "00000000-0000-4000-8000-000000000001",
    "title": "",
    "createdAt": "2026-09-30T18:42:15.000Z",
    "updatedAt": "2026-09-30T18:42:15.000Z"
  },
  "board": { "backgroundColor": "#25282B", "strokes": [], "quickNotes": [] },
  "elements": [],
  "notebook": [],
  "timeline": [],
  "moduleLayouts": {},
  "filters": {
    "visibleStatuses": ["Disponible", "Asignada", "En camino", "En el lugar", "En traslado", "En destino", "Operativa", "Inoperativa"]
  }
}
